{
  "schema": 1,
  "lesson": "1.1",
  "mode": 2,
  "label": "Weiterer Lernweg · Vorlage",
  "phases": {
    "informieren": {
      "minutes": 270,
      "html": "<section class=\"task-card phase-mode\" data-mode-panel=\"1\" data-phase=\"informieren\" aria-label=\"Informieren · Weg 1\"><div class=\"task-text\"><article class=\"assignment-frame\" data-task-number=\"1\" data-goodnotes-task=\"true\" data-task-id=\"0:1:1\" data-task-signature=\"ecf3d495\"><div class=\"assignment-rail\"><div class=\"assignment-rail-top\"><span class=\"assignment-number\" aria-label=\"Aufgabe 1\">1</span><img class=\"assignment-goodnotes\" src=\"assets/goodnotes.png\" width=\"20\" height=\"20\" alt=\"Im Goodnotes-Arbeitsheft bearbeiten\" title=\"Goodnotes: Seiten 2, 3\"></div><div class=\"assignment-kind\" data-learning-kind=\"T\"><svg viewbox=\"0 0 24 24\" fill=\"none\" stroke=\"currentColor\" stroke-width=\"1.7\" stroke-linecap=\"round\" stroke-linejoin=\"round\" aria-hidden=\"true\"><path d=\"M12 5c-3-2-6-2-9-1v14c3-1 6-1 9 1 3-2 6-2 9-1V4c-3-1-6-1-9 1z\"></path><path d=\"M12 5v14M6 8h3M6 11h3M15 8h3M15 11h3\"></path></svg><span>Theorie</span></div><div class=\"assignment-social\" data-social-form=\"single\"><svg viewbox=\"0 0 24 24\" fill=\"none\" stroke=\"currentColor\" stroke-width=\"1.7\" stroke-linecap=\"round\" stroke-linejoin=\"round\" aria-hidden=\"true\"><circle cx=\"12\" cy=\"7\" r=\"3\"></circle><path d=\"M5 21v-3a7 7 0 0 1 14 0v3\"></path></svg><span>Einzelarbeit</span></div></div><div class=\"assignment-body\"><p class=\"assignment-command\"><strong class=\"operator\">Untersucht</strong> Emilias Aussage über Konsequenz in M4, Abschnitt „Emilias Rückblick“, und M2, Abschnitt „Theo in der Bauecke“. <strong class=\"operator\">Unterstreicht</strong> die Behauptung und rahmt den beobachteten Vorgang ein. <strong class=\"operator\">Formuliert</strong> eine Frage, die sich durch weitere Beobachtung beantworten ließe. <span class=\"assignment-time\">(<svg viewbox=\"0 0 24 24\" fill=\"none\" stroke=\"currentColor\" stroke-width=\"1.8\" aria-hidden=\"true\"><circle cx=\"12\" cy=\"12\" r=\"9\"></circle><path d=\"M12 6v6l4 2\"></path></svg> ca. 30 Min.)</span></p><p class=\"assignment-note\">Arbeitshilfe: Aussage im Wortlaut | Beobachtungsgrundlage | Verallgemeinerung | mögliche Gegenbeobachtung; anschließend Rolle | vereinbarte Aufgabe | Rückfrage an die Fachkraft.</p><span class=\"book-reference\"><span class=\"book-ref-label\"><img class=\"book-ref-icon\" src=\"assets/lehrbuch-icon.png\" width=\"35\" height=\"14\" alt=\"\" aria-hidden=\"true\">Lehrbuch zur Aufgabe:</span> Hobmair Pädagogik: „Beobachtung“, S. 24; „Alltagstheorie“, S. 31.</span></div><label class=\"task-completion no-print\" data-completion-label=\"\" contenteditable=\"false\"><input type=\"checkbox\" data-task-complete=\"\" data-task-id=\"0:1:1\" aria-label=\"Aufgabe 1 als erledigt markieren\" disabled><span class=\"sr-only\">Aufgabe erledigt</span></label></article><article class=\"assignment-frame\" data-task-number=\"2\" data-goodnotes-task=\"true\" data-task-id=\"0:1:2\" data-task-signature=\"428a0bdc\"><div class=\"assignment-rail\"><div class=\"assignment-rail-top\"><span class=\"assignment-number\" aria-label=\"Aufgabe 2\">2</span><img class=\"assignment-goodnotes\" src=\"assets/goodnotes.png\" width=\"20\" height=\"20\" alt=\"Im Goodnotes-Arbeitsheft bearbeiten\" title=\"Goodnotes: Seiten 2, 3\"></div><div class=\"assignment-kind\" data-learning-kind=\"T\"><svg viewbox=\"0 0 24 24\" fill=\"none\" stroke=\"currentColor\" stroke-width=\"1.7\" stroke-linecap=\"round\" stroke-linejoin=\"round\" aria-hidden=\"true\"><path d=\"M12 5c-3-2-6-2-9-1v14c3-1 6-1 9 1 3-2 6-2 9-1V4c-3-1-6-1-9 1z\"></path><path d=\"M12 5v14M6 8h3M6 11h3M15 8h3M15 11h3\"></path></svg><span>Theorie</span></div><div class=\"assignment-social\" data-social-form=\"single\"><svg viewbox=\"0 0 24 24\" fill=\"none\" stroke=\"currentColor\" stroke-width=\"1.7\" stroke-linecap=\"round\" stroke-linejoin=\"round\" aria-hidden=\"true\"><circle cx=\"12\" cy=\"7\" r=\"3\"></circle><path d=\"M5 21v-3a7 7 0 0 1 14 0v3\"></path></svg><span>Einzelarbeit</span></div></div><div class=\"assignment-body\"><p class=\"assignment-command\"><strong class=\"operator\">Erarbeitet</strong> mit dem Lehrbuch Merkmale wissenschaftlicher Begründungen und wendet sie auf M3, die Vergleichstabelle und ergänzten Aufzeichnungen, an. <strong class=\"operator\">Erläutert</strong> Nachprüfbarkeit, Gegenbeleg und begrenzte Reichweite am vorhandenen Beispiel „Loben wirkt immer“. <strong class=\"operator\">Entwickelt</strong> eine prüfbare Alternative. <strong class=\"operator\">Zeigt</strong> anschließend an einer Teamdeutung, welches Bild vom Kind darin erkennbar wird und welche Beteiligungsmöglichkeit dadurch übersehen werden könnte. <span class=\"assignment-time\">(<svg viewbox=\"0 0 24 24\" fill=\"none\" stroke=\"currentColor\" stroke-width=\"1.8\" aria-hidden=\"true\"><circle cx=\"12\" cy=\"12\" r=\"9\"></circle><path d=\"M12 6v6l4 2\"></path></svg> ca. 45 Min.)</span></p><span class=\"book-reference\"><span class=\"book-ref-label\"><img class=\"book-ref-icon\" src=\"assets/lehrbuch-icon.png\" width=\"35\" height=\"14\" alt=\"\" aria-hidden=\"true\">Lehrbuch zur Aufgabe:</span> Hobmair Pädagogik: „Beobachtung“, S. 24; „Wissenschaft“, S. 18; „Erfahrungswissenschaftliche Methoden“, S. 23; „Menschenbild“, S. 70, 88 und 212.</span></div><label class=\"task-completion no-print\" data-completion-label=\"\" contenteditable=\"false\"><input type=\"checkbox\" data-task-complete=\"\" data-task-id=\"0:1:2\" aria-label=\"Aufgabe 2 als erledigt markieren\" disabled><span class=\"sr-only\">Aufgabe erledigt</span></label></article><article class=\"assignment-frame\" data-task-number=\"3\" data-goodnotes-task=\"true\" data-task-id=\"0:1:3\" data-task-signature=\"9738b53f\"><div class=\"assignment-rail\"><div class=\"assignment-rail-top\"><span class=\"assignment-number\" aria-label=\"Aufgabe 3\">3</span><img class=\"assignment-goodnotes\" src=\"assets/goodnotes.png\" width=\"20\" height=\"20\" alt=\"Im Goodnotes-Arbeitsheft bearbeiten\" title=\"Goodnotes: Seiten 2, 3\"></div><div class=\"assignment-kind\" data-learning-kind=\"PT\"><svg viewbox=\"0 0 24 24\" fill=\"none\" stroke=\"currentColor\" stroke-width=\"1.7\" stroke-linecap=\"round\" stroke-linejoin=\"round\" aria-hidden=\"true\"><path d=\"M4 3h12v11H4zM7 6h6M7 9h4M17 7l3 3-3 3M20 10h-3M8 17l-3 3 3 3M5 20h9a5 5 0 0 0 5-5\"></path></svg><span>Praxistheorie</span></div><div class=\"assignment-social\" data-social-form=\"group\"><svg viewbox=\"0 0 24 24\" fill=\"none\" stroke=\"currentColor\" stroke-width=\"1.7\" stroke-linecap=\"round\" stroke-linejoin=\"round\" aria-hidden=\"true\"><circle cx=\"12\" cy=\"6\" r=\"3\"></circle><circle cx=\"4\" cy=\"9\" r=\"2\"></circle><circle cx=\"20\" cy=\"9\" r=\"2\"></circle><path d=\"M6 21v-3a6 6 0 0 1 12 0v3M1 21v-3a4 4 0 0 1 4-4M23 21v-3a4 4 0 0 0-4-4\"></path></svg><span>Gruppenarbeit</span></div></div><div class=\"assignment-body\"><p class=\"assignment-command\"><strong class=\"operator\">Vergleicht</strong> die Deutungen zu Theo, Martha und Leyla in M2, jeweils die erste Notiz und die ergänzenden Beobachtungen. Drei Personen übernehmen zunächst je eine Szene in M2, einem der Abschnitte zu Theo, Martha und Leyla; die vierte prüft die Beobachtungsgrundlage der Teamsitzung in M4, Abschnitt „Emilias Rückblick“. <strong class=\"operator\">Führt</strong> die Befunde zusammen und wechselt bei Rückfragen die Erklärrolle. <strong class=\"operator\">Haltet</strong> je Szene eine plausible andere Erklärung fest, ohne sie zur Falltatsache zu erklären. <span class=\"assignment-time\">(<svg viewbox=\"0 0 24 24\" fill=\"none\" stroke=\"currentColor\" stroke-width=\"1.8\" aria-hidden=\"true\"><circle cx=\"12\" cy=\"12\" r=\"9\"></circle><path d=\"M12 6v6l4 2\"></path></svg> ca. 40 Min.)</span></p><span class=\"book-reference\"><span class=\"book-ref-label\"><img class=\"book-ref-icon\" src=\"assets/lehrbuch-icon.png\" width=\"35\" height=\"14\" alt=\"\" aria-hidden=\"true\">Lehrbuch zur Aufgabe:</span> Hobmair Pädagogik: „Beobachtung“, S. 24; „Pädagogische Handlungskompetenz“, S. 33.</span></div><label class=\"task-completion no-print\" data-completion-label=\"\" contenteditable=\"false\"><input type=\"checkbox\" data-task-complete=\"\" data-task-id=\"0:1:3\" aria-label=\"Aufgabe 3 als erledigt markieren\" disabled><span class=\"sr-only\">Aufgabe erledigt</span></label></article><article class=\"assignment-frame\" data-task-number=\"4\" data-goodnotes-task=\"true\" data-task-id=\"0:1:4\" data-task-signature=\"cb52f1b5\"><div class=\"assignment-rail\"><div class=\"assignment-rail-top\"><span class=\"assignment-number\" aria-label=\"Aufgabe 4\">4</span><img class=\"assignment-goodnotes\" src=\"assets/goodnotes.png\" width=\"20\" height=\"20\" alt=\"Im Goodnotes-Arbeitsheft bearbeiten\" title=\"Goodnotes: Seiten 2, 3\"></div><div class=\"assignment-kind\" data-learning-kind=\"PT\"><svg viewbox=\"0 0 24 24\" fill=\"none\" stroke=\"currentColor\" stroke-width=\"1.7\" stroke-linecap=\"round\" stroke-linejoin=\"round\" aria-hidden=\"true\"><path d=\"M4 3h12v11H4zM7 6h6M7 9h4M17 7l3 3-3 3M20 10h-3M8 17l-3 3 3 3M5 20h9a5 5 0 0 0 5-5\"></path></svg><span>Praxistheorie</span></div><div class=\"assignment-social\" data-social-form=\"group\"><svg viewbox=\"0 0 24 24\" fill=\"none\" stroke=\"currentColor\" stroke-width=\"1.7\" stroke-linecap=\"round\" stroke-linejoin=\"round\" aria-hidden=\"true\"><circle cx=\"12\" cy=\"6\" r=\"3\"></circle><circle cx=\"4\" cy=\"9\" r=\"2\"></circle><circle cx=\"20\" cy=\"9\" r=\"2\"></circle><path d=\"M6 21v-3a6 6 0 0 1 12 0v3M1 21v-3a4 4 0 0 1 4-4M23 21v-3a4 4 0 0 0-4-4\"></path></svg><span>Gruppenarbeit</span></div></div><div class=\"assignment-body\"><p class=\"assignment-command\"><strong class=\"operator\">Klärt</strong> mit M1, den Personenbeschreibungen und der Zuständigkeitsübersicht, die Verantwortung der Praxisgruppe und Emil